<?xml version="1.0" encoding="UTF-8" standalone="no"?>
<!DOCTYPE Almacen SYSTEM "Almacen.dtd">
<Almacen>
          <Productos>
                    <Producto Codigo="123">
                              <NombreProducto>fg</NombreProducto>
                              <Descripcion>f</Descripcion>
                              <Stock>f</Stock>
                              <Pendientes>f</Pendientes>
                              <Localizacion>
                                        <Pasillo>f</Pasillo>
                                        <Estanteria>f</Estanteria>
                                        <Estante>f</Estante>
                              </Localizacion>
                    </Producto>
          </Productos>
          <Clientes>
                    <Cliente Id="12">
                              <Nombre>12</Nombre>
                              <Apellidos>f</Apellidos>
                              <Email>f</Email>
                              <Telefono>f</Telefono>
                              <Direccion>
                                        <Calle>f</Calle>
                                        <Numero>f</Numero>
                                        <CodigoPostal>f</CodigoPostal>
                                        <Poblacion>f</Poblacion>
                                        <Pais>f</Pais>
                              </Direccion>
                    </Cliente>
          </Clientes>
          <Pedidos>
                    <Producto Codigo="23">
                              <NombreProducto>z</NombreProducto>
                              <Descripcion>z</Descripcion>
                              <Stock>z</Stock>
                              <Pendientes>z</Pendientes>
                              <Localizacion>
                                        <Pasillo>z</Pasillo>
                                        <Estanteria>z</Estanteria>
                                        <Estante>z</Estante>
                              </Localizacion>
                    </Producto>
          </Pedidos>
</Almacen>
